url,GTIN,Product Name,Description,Ingredients,Pack Size,Product Format,Slice Weight,Product Performance,Item Type,Slice Length,Slice Width
yellow-light-pasteurized-process-american-cheese-snack-slices-1-24-2-600-stacks-of-5-slices/,071505948227,YELLOW LIGHT PASTEURIZED PROCESS AMERICAN CHEESE SNACK SLICES – 1/24.2# 600 STACKS OF 5 SLICES,"These small, pre-portioned stacks of cheese are ideal for creating snack kits. And, what’s more, these Yellow Light Pasteurized Process American Cheese Snack Slices have 50% less fat and 30% fewer calories than regular pasteurized process American cheese. Add a creamy, cheesy touch to a snack pack.","MILK, WATER, MILK PROTEIN CONCENTRATE*, WHEY*, MODIFIED FOOD STARCH*, SODIUM CITRATE, SALT, LACTIC ACID, POTASSIUM CITRATE, CHEESE CULTURE, SORBIC ACID (PRESERVATIVE), ENZYMES, COLOR ADDED. *INGREDIENT NOT IN REGULAR PASTEURIZED PROCESS AMERICAN CHEESE CONTAINS: MILK",1/24.2#,Slice,0.13oz.,Ready to Eat,PROCESSED CHEESE,1.1875,1.625
american-heritage-low-moisture-part-skim-mozzarrella-feather-shreds-12-8oz/,030900911366,AMERICAN HERITAGE LOW MOISTURE PART-SKIM MOZZARRELLA FEATHER SHREDS – 12/8OZ,"Low Moisture Part-Skim Mozzarella feather shredded cheese has a clean, slightly salty dairy profile making it the perfect ingredient to take your culinary creations to the next level. Anything from pizzas, omelets, and skillets to pasta and salads gets even better with that craveable texture and flavor that everyone loves.","LOW-MOISTURE PART-SKIM MOZZARELLA CHEESE (PASTEURIZED PART-SKIM MILK, CHEESE CULTURE, SALT, ENZYMES), POTATO STARCH ADDED TO PREVENT CAKING, NATAMYCIN (A NATURAL MOLD INHIBITOR). CONTAINS: MILK",12/8OZ,Shredded,,Hot Application - Internal Melt; Hot Application - Topical Melt; Cold Application,NATURAL CHEESE,,
schreiber-colby-longhorn-1-14-random-weight/,071505552714,SCHREIBER COLBY LONGHORN – 1/14# RANDOM WEIGHT,"With its mild and buttery flavor profile, this cheese is perfect for a variety of applications. A firm body and slightly curdy texture make it perfect for shredding and slicing, adding a burst of flavor to sandwiches, burgers, omelets, and more. An excellent melting cheese, Colby can be enjoyed in both hot and cold applications. Whether melted or enjoyed straight from the block, our longhorn cheeses promise consistent quality and performance.","PASTEURIZED MILK, CHEESE CULTURE, SALT, ENZYMES, COLOR ADDED. CONTAINS: MILK",1/14#R,Chunk,,Ready to Eat,NATURAL CHEESE,,
schreiber-whole-milk-12-32-fl-oz/,071505023993,SCHREIBER WHOLE MILK 12/32 FL OZ,"An irresistible combination of flavor and freshness, our whole milk is more than just a beverage – it’s a promise of quality and versatility from a dairy expert. From more complex baking applications to simple dishes like cereal, or even just pouring a tall glass for a refreshing sip, its creamy texture and rich taste help you create an unforgettable experience every time. And, with extended shelf life and efficient one-quart cartons, you can maximize your storage space while delighting all those you serve.","MILK, VITAMIN D3. CONTAINS: MILK",12/32FLOZ,Milk,,Ready to Drink,BEVERAGES,,
schreiber-pasteurized-process-swiss-american-slices-4-5-160-slices/,071505013840,SCHREIBER PASTEURIZED PROCESS SWISS AMERICAN SLICES – 4/5# 160 SLICES,"Elevate your menu to new levels with the perfect combination of American and Swiss flavors. Schreiber Pasteurized Process Swiss American Slices have a clean, slightly salty flavor profile that helps you delight taste buds with every bite. It also features a smooth, medium-firm texture and moderate melt when heated, making it the perfect addition to a wide range of dishes like chicken sandwiches, classic grilled cheese, juicy burgers, and hot ham and cheese.","MILK AND PART-SKIM MILK, CREAM, WATER, SODIUM CITRATE, SALT, CHEESE CULTURE, CITRIC ACID, SORBIC ACID (PRESERVATIVE), ENZYMES, SOY LECITHIN. CONTAINS: MILK, SOY",4/5#,Slice,0.5oz.,Hot Application - Internal Melt,PROCESSED CHEESE,3,3
plain-cream-cheese-spread-bulk-1-30/,071505023597,PLAIN CREAM CHEESE SPREAD BULK – 1/30#,"Want to add a creamy touch to your offerings? This bulk cream cheese is the perfect solution. With their soft, spreadable texture and mild flavor profile, it’s versatile enough to enhance a variety of dishes. Whether you’re spreading them on a bagel or pastry, mixing them into a flavorful spread, or incorporating them into sandwiches and wraps, this cream cheese will elevate your kitchen creations effortlessly.","PASTEURIZED MILK AND CREAM, CHEESE CULTURE, SALT, GUAR GUM, CITRIC ACID, XANTHAN GUM, CAROB BEAN GUM, NATAMYCIN (A NATURAL MOLD INHIBITOR). CONTAINS: MILK",1/30#,Bulk,,SPREADING,CREAM CHEESE,,
schreiber-swiss-slices-12-1-32-slices/,071505015578,SCHREIBER SWISS SLICES – 12/1# 32 SLICES,"Our Swiss cheese slices feature a mild, sweet, nutty flavor profile and a firm body and smooth texture that melts beautifully when heated. Whether you’re serving up hot or cold sandwiches or creating a mouthwatering meat and cheese tray, this natural cheese is the perfect addition to your menu lineup!","PART-SKIM MILK, CHEESE CULTURE, SALT, ENZYMES. AGED OVER 60 DAYS. CONTAINS: MILK",12/1#,Slice,0.5oz.,Cold Application; Hot Application - Internal Melt,NATURAL CHEESE,3.88,3.88
schreiber-colby-jack-longhorn-1-14-random-weight/,071505562669,SCHREIBER COLBY JACK LONGHORN – 1/14# RANDOM WEIGHT,"With a mild, sweet, and tangy flavor profile, this cheese is perfect for a variety of applications. A firm body and smooth texture make it simple to shred and slice, making it easy to add a burst of flavor to sandwiches, burgers, omelets, and more. Whether melted or enjoyed straight from the block, our longhorn cheeses promise consistent quality and performance, elevating every dish with their savory goodness.","PASTEURIZED MILK, CHEESE CULTURE, SALT, ENZYMES, COLOR ADDED (IN COLBY CHEESE). CONTAINS: MILK",1/14#R,Chunk,,Ready to Eat,NATURAL CHEESE,,
mexican-blend-fancy-shreds-4-5/,071505960229,MEXICAN BLEND FANCY SHREDS – 4/5#,"Streamline your operation with this ready-to-use shredded cheese blend! Made from a combination of Monterey Jack, Mild Cheddar, Queso Quesadilla, and Asadero cheeses, it offers a unique flavor profile that is a perfect addition to your Mexican dish. And, with its curdy, creamy smooth texture and fancy shred, it provides great coverage and melts seamlessly over any dish, from salads and tacos to pasta and pizza.","MONTEREY JACK CHEESE (PASTEURIZED MILK, CHEESE CULTURE, SALT, ENZYMES), CHEDDAR CHEESE (PASTEURIZED MILK, CHEESE CULTURE, SALT, ENZYMES, COLOR ADDED), QUESO QUESADILLA CHEESE (PASTEURIZED MILK, CHEESE CULTURE, SALT, ENZYMES), ASADERO CHEESE (PASTEURIZED MILK, CHEESE CULTURE, SALT, ENZYMES), POTATO STARCH ADDED TO PREVENT CAKING, NATAMYCIN (A NATURAL MOLD INHIBITOR). CONTAINS: MILK",4/5#,Shredded,,Hot Application - Internal Melt; Hot Application - Topical Melt; Cold Application,NATURAL CHEESE,,
schreiber-white-pasteurized-process-american-slices-4-5-160-slices/,071505013741,SCHREIBER WHITE PASTEURIZED PROCESS AMERICAN SLICES – 4/5# 160 SLICES,"Whether you’re topping juicy burgers, making perfectly golden, grilled cheese sandwiches, or creating a crispy chicken sandwich, the smooth and melty texture of Schreiber White Pasteurized Process American Slices is going to help you elevate every dish to gourmet status. And, with its horizontal stack and EZ Pick staggered slices, kitchen prep becomes effortless, ensuring easy separation, minimal waste, and unforgettable flavor in every bite.","MILK, CREAM, WATER, SODIUM CITRATE, SALT, CHEESE CULTURE, SORBIC ACID (PRESERVATIVE), ENZYMES, CITRIC ACID, SOY LECITHIN. CONTAINS: MILK, SOY",4/5#,Slice,0.5oz.,Hot Application - Internal Melt,PROCESSED CHEESE,3,3
pauly-colby-jack-loaf-2-5/,030900007281,PAULY COLBY JACK LOAF – 2/5#,"Colby Jack is the perfect combination of convenience and versatility. With its mild, sweet, and tangy flavor profile, it’s easy to add a burst of flavor to any dish. Plus, its slightly soft body and curdy texture make it ideal for shredding, slicing, or cubing. So, whether you’re crafting sandwiches, burgers, omelets, pasta, or quesadillas, you’ve found the perfect cheese.","PASTEURIZED MILK, CHEESE CULTURE, SALT, ENZYMES, ANNATTO COLOR (IN COLBY CHEESE). CONTAINS: MILK",2/5#,Chunk,,Ready to Eat,NATURAL CHEESE,11.15,3.5
american-heritage-sharp-cheddar-chunk-12-8oz/,030900911656,AMERICAN HERITAGE SHARP CHEDDAR CHUNK – 12/8OZ,"Our Sharp Cheddar cheese boasts a full, rich flavor that’s sharp on the tongue followed by a delightful sweetness typical of Cheddar. Its firm body and smooth, slightly crumbly texture make it perfect for shredding or slicing, allowing you to customize your dishes with ease. Whether sprinkled on omelets, pasta, or soups, or featured on a decadent meat and cheese platter for snacking, our sharp cheddar helps add a burst of flavor that consumers will love.","PASTEURIZED MILK, CHEESE CULTURE, SALT, ENZYMES, COLOR ADDED. CONTAINS: MILK",12/8OZ,Chunk,,Ready to Eat,NATURAL CHEESE,,
schreiber-white-pasteurized-process-cheese-product-slices-4-5-160-slices/,071505017145,SCHREIBER WHITE PASTEURIZED PROCESS CHEESE PRODUCT SLICES – 4/5# 160 SLICES,"With a mild American flavor profile and smooth, firm texture, this cheese is the perfect addition to burgers, grilled cheese sandwiches, or even a delicious egg sandwich, but at a more cost effective price point than American cheese. Plus, with its convenient pre-portioned slices and EZ Pick staggered design, it streamlines kitchen preparation, reduces waste, and ensures hassle-free cooking every time. So go ahead, add a creamy, melty touch to all your most popular dishes!","MILK, WATER, DAIRY PRODUCT SOLIDS, SODIUM CITRATE, MODIFIED FOOD STARCH, SALT, CONTAINS 2% OR LESS OF CHEESE CULTURE, CITRIC ACID, CREAM, ENZYMES, SORBIC ACID (PRESERVATIVE), SOY LECITHIN. CONTAINS: MILK, SOY",4/5#,Slice,0.5oz.,Hot Application - Internal Melt,PROCESSED CHEESE,3,3
pasteurized-process-pepper-jack-cheese-product-restricted-melt-1-4-diced-4-5/,071505955836,PASTEURIZED PROCESS PEPPER JACK CHEESE PRODUCT RESTRICTED MELT 1/4″ DICED – 4/5#,"This diced cheese will help you spice up your menu with the perfect blend of flavor and convenience. It has a slightly salty Monterey Jack flavor profile complemented by a hint of mild heat from peppers that will add a kick to any culinary creation. And, because it’s already diced for consistent cut and quality, it’s easy to add to baked bread, stuffed sausages, burgers, and more. Plus, it’s designed to withstand high-heat situations and freeze thaw applications, ensuring that every bite looks and tastes spectacular.","MONTEREY JACK AND AMERICAN PASTEURIZED PROCESS CHEESE PRODUCT WITH JALAPENOS (MILK, WATER, CREAM, SODIUM PHOSPHATE, SALT, JALAPENO PEPPERS, CHEESE CULTURE, SORBIC ACID [PRESERVATIVE], COLOR ADDED, ENZYMES), POWDERED CELLULOSE ADDED TO PREVENT CAKING, NATAMYCIN (A NATURAL MOLD INHIBITOR). CONTAINS: MILK",4/5#,Shredded,,HOT APPLICATION - RESTRICTED MELT,PROCESSED CHEESE,,
schreiber-skim-milk-6-32-fl-oz/,071505024013,SCHREIBER SKIM MILK 6/32 FL OZ,"Looking to offer your customers great flavor with the lowest fat content available? Our skim milk helps you do just that across your entire menu. From more complex baking applications to simple dishes like cereal, or even just pouring a tall glass for a refreshing sip, its creamy texture and rich taste help you create an unforgettable experience every time. And, with extended shelf life and efficient one-quart cartons, you can maximize your storage space while delighting all those you serve.","NONFAT MILK, VITAMIN A PALMITATE, VITAMIN D3. CONTAINS: MILK",6/32FLOZ,Milk,,Ready to Drink,BEVERAGES,,
schreiber-gouda-slices-6-1-5-twin-stack-32-slices/,071505022262,SCHREIBER GOUDA SLICES – 6/1.5# TWIN STACK 32 SLICES,"Crafted with the utmost care, Schreiber Gouda Slices have a creamy, full flavor that’s nutty, sweet, and guaranteed to delight your consumers’ taste buds. With a smooth, dense, and crumbly texture, they’re perfect for adding that extra touch of indulgence to burgers, sandwiches, soups, and sauces. And, with two separate stacks of cheese slices, you’ll enjoy consistent cut and quality every time, reducing labor costs and eliminating product waste.","PASTEURIZED MILK, CHEESE CULTURE, SALT, ENZYMES, COLOR ADDED. CONTAINS: MILK",6/1.5#,Slice,0.75oz.,Cold Application; Hot Application - Internal Melt,NATURAL CHEESE,3.5,3.66
american-heritage-provolone-slices-8-6oz-shingle-8-slices/,071505017916,AMERICAN HERITAGE PROVOLONE SLICES – 8/6OZ SHINGLE 8 SLICES,"This sliced Provolone cheese will make your life easier and your dishes even tastier. Whether you’re crafting cold deli subs or hot philly cheesesteak sandwiches, the buttery, mild, tangy flavor profile will take your dishes from delicious to irresistible. And with their consistent cut and quality, they’re great at helping you reduce labor costs and eliminate product waste.","PASTEURIZED MILK, CHEESE CULTURE, SALT, ENZYMES. CONTAINS: MILK",8/6OZ,Slice,0.75oz.,Cold Application; Hot Application - Internal Melt,NATURAL CHEESE,3.5,3.5
raskas-cream-cheese-spread-6-pack-portion-control-cup-36-1oz/,071505017404,RASKAS CREAM CHEESE SPREAD 6 PACK PORTION CONTROL CUP – 36/1OZ,"Want to add a creamy touch to your offerings? These cream cheese portion cups are the perfect solution. With their soft, spreadable texture and mild flavor profile, they’re versatile enough to enhance a variety of dishes. Whether you’re spreading them on a bagel or pastry, mixing them into a flavorful spread, or incorporating them into sandwiches and wraps, these cream cheese portion cups will elevate your kitchen creations effortlessly. Plus, their convenient size makes them easy to store and serve on breakfast buffets.","PASTEURIZED MILK AND CREAM, CHEESE CULTURE, SALT, GUAR GUM, CITRIC ACID, XANTHAN GUM, CAROB BEAN GUM, NATAMYCIN (A NATURAL MOLD INHIBITOR). CONTAINS: MILK",6/36/1OZ,Portion,,SPREADING,CREAM CHEESE,,
schreiber-yellow-pasteurized-process-american-slices-4-5-flow-through-wrapper-120-slices/,071505014069,SCHREIBER YELLOW PASTEURIZED PROCESS AMERICAN SLICES – 4/5# FLOW THROUGH WRAPPER 120 SLICES,"Whether you’re topping juicy burgers, making perfectly golden, grilled cheese sandwiches, or creating a crispy chicken sandwich, the smooth and melty texture of Schreiber Yellow Pasteurized Process American Slices is going to help you elevate every dish to gourmet status. And, with its horizontal stack and EZ Pick staggered slices, kitchen prep becomes effortless, ensuring easy separation, minimal waste, and unforgettable flavor in every bite.","MILK, CREAM, WATER, SODIUM CITRATE, SALT, CHEESE CULTURE, SORBIC ACID (PRESERVATIVE), CITRIC ACID, ENZYMES, SOY LECITHIN, COLOR ADDED. CONTAINS: MILK, SOY",4/5#,Slice,0.67oz.,Hot Application - Internal Melt,PROCESSED CHEESE,3.375,3.375
schreiber-yellow-pasteurized-process-restricted-melt-american-slices-4-5-184-slices/,071505013857,SCHREIBER YELLOW PASTEURIZED PROCESS RESTRICTED MELT AMERICAN SLICES – 4/5# 184 SLICES,"Bring some sizzle to your grilling game using a creamy, delicious process cheese That’s crafted to withstand high heat. With an innovative horizontal stack and EZ Pick slices, separating and adding a decadent layer of flavor has never been easier. Simply put, it’s the best cheese for freeze and reheat applications like breakfast sandwiches and burritos or high heat applications like stuffed burgers. We’d say get ready for pure cheesy perfection, but there’s no prep needed. So, it looks like you and your consumers can just relax and enjoy.","MILK, WATER, CREAM, SODIUM CITRATE, SALT, CHEESE CULTURE, TETRASODIUM PYROPHOSPHATE, SORBIC ACID (PRESERVATIVE), ENZYMES, SOY LECITHIN, CITRIC ACID, COLOR ADDED. CONTAINS: MILK, SOY",4/5#,Slice,0.43oz.,Hot Application - Restricted Melt,PROCESSED CHEESE,3,3
pauly-cream-cheese-baking-ingredient-bulk-1-30/,7027260043,PAULY CREAM CHEESE BAKING INGREDIENT BULK – 1/30#,"With a unique formulation this cream cheese is the perfect choice for adding richness and flavor to your menu. Whether baked into cheesecakes, frostings, dips, or pastries, its mild flavor profile with cultured dairy notes makes it easy to delight even the most demanding taste buds. And the larger packaging helps eliminate hassle and waste making it perfect for high-volume applications.","PASTEURIZED MILK AND CREAM, CHEESE CULTURE, SALT, CAROB BEAN GUM, GUAR GUM. CONTAINS: MILK",1/30#,Bulk,,Baking/Frosting,CREAM CHEESE,,
pauly-colby-jack-mini-longhorn-2-6-random-weight/,030900464930,PAULY COLBY JACK MINI LONGHORN – 2/6# RANDOM WEIGHT,"This Pauly Colby Jack Loaf is the perfect combination of convenience and versatility. With its mild, sweet, and tangy flavor profile, it’s easy to add a burst of flavor to any dish. Plus, its slightly soft body and curdy texture make it ideal for shredding or slicing. So, whether you’re crafting sandwiches, burgers, omelets, pasta, or quesadillas, you’ve found the perfect cheese.","PASTEURIZED MILK, CHEESE CULTURE, SALT, ENZYMES, ANNATTO COLOR (IN COLBY CHEESE). CONTAINS: MILK",2/6#R,Chunk,,Ready to Eat,NATURAL CHEESE,,
schreiber-mild-cheddar-snack-bar-2-50-75oz/,071505015295,SCHREIBER MILD CHEDDAR SNACK BAR – 2/50/.75OZ,"For an easy on-the-go snack for consumers, Schreiber Mild Cheddar Snack Bars offer a convenient and prepackaged cheese solution. The full, rich flavor profile, followed by a beloved sweet Cheddar flavor in each bite, entices consumers to keep coming back for these snack offerings.","PASTEURIZED MILK, CHEESE CULTURE, SALT, ENZYMES, COLOR ADDED. CONTAINS: MILK",2/50/.75,Snack,,Ready to Eat,NATURAL CHEESE,,
schreiber-medium-cheddar-loaf-2-5/,071505016452,SCHREIBER MEDIUM CHEDDAR LOAF – 2/5#,"Schreiber Medium Cheddar promises unbeatable quality and performance for those who prefer to shred, slice, or cube straight from the block. It has a clean, moderately sharp flavor profile followed by a hint of sweetness and a firm body makes it ideal for shredding, slicing, or cubing. it’s never been easier to add a deliciously creamy touch to sandwiches, burgers, omelets, pasta, soups and more.","PASTEURIZED MILK, CHEESE CULTURE, SALT, ENZYMES, COLOR ADDED. CONTAINS: MILK",2/5#,Chunk,,Ready to Eat,NATURAL CHEESE,,
raskas-neufchatel-bulk-1-30/,030900003030,RASKAS NEUFCHATEL BULK – 1/30#,"With its reduced fat and calorie content, this is the perfect option for health-conscious consumers without compromising on flavor or quality. It has a clean, mild flavor profile with subtle cultured dairy notes and a smooth, medium-firm texture that makes it a versatile ingredient for both sweet and savory dishes. So, whether you’re whipping up cheesecakes, frostings, dips, or savory spreads, it delivers rich, creamy goodness in every bite.","PASTEURIZED MILK AND CREAM, SKIM MILK, CHEESE CULTURE, SALT, GUAR GUM, XANTHAN GUM, CAROB BEAN GUM. CONTAINS: MILK",1/30#,Bulk,,Baking/Frosting; Spreading,CREAM CHEESE,,
culinary-cream-cheese-spread-bulk-1-30/,071505002165,CULINARY CREAM CHEESE SPREAD BULK – 1/30#,"This cream cheese features a soft, creamy texture and clean, mild flavor profile, making it a versatile kitchen essential. Whether you’re whipping up sandwiches, wraps, sauces, dips, dressings, or desserts, this Culinary Cream Cheese Spread will help you make things even more delicious. It even holds up beautifully in fried applications and is freeze-thaw stable, so there’s no limit to what it can do for your operation.","PASTEURIZED MILK AND CREAM, WATER, WHEY PROTEIN CONCENTRATE, SALT, CHEESE CULTURE, MODIFIED FOOD STARCH, GUAR GUM, POTASSIUM SORBATE (PRESERVATIVE), LACTIC ACID, XANTHAN GUM, CAROB BEAN GUM, NATURAL FLAVOR, ENZYMES. CONTAINS: MILK",1/30#,Bulk,,Spreading,CREAM CHEESE,,
schreiber-provolone-loaf-3-12-random-weight/,071505016940,SCHREIBER PROVOLONE LOAF – 3/12# RANDOM WEIGHT,"Take your sandwiches and cheesesteaks to the next level with this delectable cheese! With its buttery, mild, and tangy flavor profile, each bite is guaranteed to be unforgettable. Its circular slice cut makes it perfect for layering and creating visually appealing dishes across the board with instant cheese type recognition.","PASTEURIZED MILK, CHEESE CULTURE, SALT, ENZYMES. CONTAINS: MILK",3/12#R,Chunk,,Ready to Eat,NATURAL CHEESE,19.75,4
land-o-lakes-lowfat-blended-vanilla-yogurt-cup-6-2/,034500635691,LAND O LAKES LOWFAT BLENDED VANILLA YOGURT CUP – 6/2#,"Looking to add a delicious and versatile ingredient to your kitchen? We’ve got just the thing. With a vanilla flavor profile and subtle cultured dairy notes, this lowfat yogurt will please even the most discerning palates. Its smooth and creamy texture makes it perfect for a variety of applications. Whether you’re serving it as a standalone breakfast or snack item, using it as a base for mouthwatering parfaits, or blending it into irresistible smoothies, this yogurt is sure to become a consumer favorite. Plus, with its 2-pound size, it’s perfect for multiple occasions, ensuring you’ll always be ready for any culinary adventure.","CULTURED PASTEURIZED GRADE A LOW FAT MILK, SUGAR, WATER, MODIFIED FOOD STARCH, NATURAL FLAVOR, ANNATTO EXTRACT AND TURMERIC (COLOR), CARRAGEENAN, PECTIN, CITRIC ACID, VANILLA EXTRACT, VITAMIN A PALMITATE, VITAMIN D3. CONTAINS: MILK",6/2#,Large Cup,,READY TO EAT,YOGURT,,
schreiber-yellow-pasteurized-process-cheese-product-slices-4-5-flow-through-wrapper-120-slices/,071505013970,SCHREIBER YELLOW PASTEURIZED PROCESS CHEESE PRODUCT SLICES – 4/5# FLOW THROUGH WRAPPER 120 SLICES,"With a mild American flavor profile and smooth, firm texture, this cheese is the perfect addition to burgers, grilled cheese sandwiches, or even a delicious egg sandwich, but at a more cost effective price point than American cheese. Plus, with its convenient pre-portioned slices and EZ Pick staggered design, it streamlines kitchen preparation, reduces waste, and ensures hassle-free cooking every time. So go ahead, add a creamy, melty touch to all your most popular dishes!","MILK, WATER, DAIRY PRODUCT SOLIDS, SODIUM CITRATE, SALT, MODIFIED FOOD STARCH, CHEESE CULTURE, CREAM, SORBIC ACID (PRESERVATIVE), ENZYMES, CITRIC ACID, SOY LECITHIN, COLOR ADDED. CONTAINS: MILK, SOY",4/5#,Slice,0.67oz.,Hot Application - Internal Melt,PROCESSED CHEESE,3.375,3.375
cream-cheese-bulk-1-50/,070272600611,CREAM CHEESE BULK – 1/50#,"This bulk, fully cultured cream cheese is a flavor powerhouse that elevates any dish. That’s right, cream cheese isn’t just for bagels anymore. With its clean, mild taste and smooth, medium-firm texture, it’s perfect for everything from cheesecakes, frostings, and savory spreads to innovative applications like sushi, tartines, and trendy cheese teas.","PASTEURIZED MILK AND CREAM, CHEESE CULTURE, SALT, GUAR GUM, XANTHAN GUM, CAROB BEAN GUM. CONTAINS: MILK",1/50#,Bulk,,Baking/Frosting; Frying; Spreading,CREAM CHEESE,,
schreiber-soft-cream-cheese-light-portion-control-cup-100-1oz/,071505018241,SCHREIBER SOFT CREAM CHEESE LIGHT PORTION CONTROL CUP – 100/1OZ,"With its clean, mild flavor and smooth, spreadable texture, Schreiber Soft Cream Cheese Light Cups are the perfect choice for restaurants and caterers alike. Whether you’re spreading it on sandwiches or bagels, using it as a dip for a quick snack, or incorporating it into your grab-and-go application, this creamy delight is sure to impress.","PASTEURIZED MILK AND CREAM, PASTEURIZED SKIM MILK, CHEESE CULTURE, SODIUM CITRATE*, SALT, GUAR GUM, MODIFIED FOOD STARCH*, XANTHAN GUM, CAROB BEAN GUM, NATURAL FLAVOR*, VITAMIN A PALMITATE, ENZYMES. *INGREDIENT NOT IN REGULAR CREAM CHEESE CONTAINS: MILK",100/1OZ,Portion,,SPREADING,CREAM CHEESE,,
american-heritage-pepper-jack-chunk-12-8oz/,030900911540,AMERICAN HERITAGE PEPPER JACK CHUNK – 12/8OZ,"Spice up your menu with this irresistible American Heritage Pepper Jack Chunk. Packed with a buttery flavor and a kick of heat from jalapeno peppers, this cheese really is a game-changer. Whether you’re slicing it thin for sandwiches and burgers or shredding it to melt over tacos and quesadillas, you can always count on a bold flavor and creamy texture that your consumers will love.","PASTEURIZED MILK, JALAPENO PEPPERS, CHEESE CULTURE, SALT, ENZYMES. CONTAINS: MILK",12/8OZ,Chunk,,Ready to Eat,NATURAL CHEESE,,
american-heritage-mild-cheddar-fancy-shreds-12-8oz/,030900204307,AMERICAN HERITAGE MILD CHEDDAR FANCY SHREDS – 12/8OZ,"Add just the right amount of everyone’s favorite mild Cheddar flavor to any culinary creation with the finest shred available. Our mild Cheddar Shreds are a staple in every kitchen, offering convenience, ease of use and consistency for consumers. Whether it’s sprinkled atop salads or tacos for a boost of appeal or melted over pasta, pizza, or a casserole for a creamy finish, it will help elevate any dish.","CHEDDAR CHEESE (PASTEURIZED MILK, CHEESE CULTURE, SALT, ENZYMES, COLOR ADDED), POTATO STARCH ADDED TO PREVENT CAKING, NATAMYCIN (A NATURAL MOLD INHIBITOR). CONTAINS: MILK",12/8OZ,Shredded,,Hot Application - Internal Melt; Hot Application - Topical Melt; Cold Application,NATURAL CHEESE,,
