url,GTIN,Product Name,Description,Ingredients,Pack Size,Product Format,Slice Weight,Product Performance,Item Type,Slice Length,Slice Width
american-heritage-soft-cream-cheese-light-cup-12-8oz/,030900111896,AMERICAN HERITAGE SOFT CREAM CHEESE LIGHT CUP – 12/8OZ,"With its clean, mild flavor and smooth, spreadable texture, American Heritage Soft Cream Cheese Light Cups are the perfect choice for restaurants and caterers alike. Whether you’re spreading it on sandwiches or bagels, using it as a dip for a quick snack, or incorporating it into your grab-and-go application, this creamy delight is sure to impress.","PASTEURIZED MILK AND CREAM, PASTEURIZED SKIM MILK, CHEESE CULTURE, SODIUM CITRATE*, SALT, GUAR GUM, MODIFIED FOOD STARCH*, XANTHAN GUM, CAROB BEAN GUM, NATURAL FLAVOR*, VITAMIN A PALMITATE, ENZYMES. *INGREDIENT NOT IN REGULAR CREAM CHEESE CONTAINS: MILK",12/8OZ,Cup,,SPREADING,CREAM CHEESE,,
schreiber-mild-cheddar-loaf-8-5/,071505016421,SCHREIBER MILD CHEDDAR LOAF – 8/5#,"Schreiber Mild Cheddar promises unbeatable quality and performance for those who prefer to shred or slice straight from the block. It has a clean, full-flavor profile with a hint of sweetness and a firm body making it ideal for shredding, slicing, or cubing. it’s never been easier to add a deliciously creamy touch to sandwiches, burgers, omelets, pasta, soups, and charcuterie boards.","PASTEURIZED MILK, CHEESE CULTURE, SALT, ENZYMES, COLOR ADDED. CONTAINS: MILK",8/5#,Chunk,,Ready to Eat,NATURAL CHEESE,,
land-o-lakes-lowfat-blended-strawberry-yogurt-cup-6-2/,034500635646,LAND O LAKES LOWFAT BLENDED STRAWBERRY YOGURT CUP – 6/2#,"Looking to elevate your menu with a burst of fruity goodness? This lowfat yogurt packs an irresistible punch with its clean strawberry flavor and smooth, creamy texture. Perfect for adding a refreshing twist to breakfasts and snacks or even as a base for mouthwatering parfaits and energizing smoothies. No matter how you use it, customers are in for a treat! Plus, with its 2-pound size, it’s perfect for multiple occasions, ensuring you’ll always be ready for any culinary adventure.","CULTURED PASTEURIZED GRADE A LOW FAT MILK, SUGAR, WATER, MODIFIED FOOD STARCH, STRAWBERRIES, NATURAL FLAVOR, CARRAGEENAN, PECTIN, CITRIC ACID, VEGETABLE JUICE AND BETA CAROTENE (COLOR), VITAMIN A PALMITATE, VITAMIN D3. CONTAINS: MILK",6/2#,Large Cup,,READY TO EAT,YOGURT,,
schreiber-cheddar-jack-50-50-fancy-shreds-4-5/,071505014199,SCHREIBER CHEDDAR JACK 50/50 FANCY SHREDS – 4/5#,"From salads to quesadillas and pasta to pizza, this cheese has you covered. We use a blend of 50% Mild Cheddar and 50% Monterey Jack, ensuring that each bite is bursting with flavor and the fancy shred gives a premium addition every time. It also provides you with a melty texture, making it easy to add a visually appealing twist to any dish on your menu.","CHEDDAR CHEESE (PASTEURIZED MILK, CHEESE CULTURE, SALT, ENZYMES, COLOR ADDED), MONTEREY JACK CHEESE (PASTEURIZED MILK, CHEESE CULTURE, SALT, ENZYMES), POTATO STARCH ADDED TO PREVENT CAKING, NATAMYCIN (A NATURAL MOLD INHIBITOR). CONTAINS: MILK",4/5#,Shredded,,HOT APPLICATION - INTERNAL MELT; HOT APPLICATION - TOPICAL MELT; COLD APPLICATION,NATURAL CHEESE,,
raskas-cream-cheese-bulk-1-30/,030900001975,RASKAS CREAM CHEESE BULK – 1/30#,"This bulk, fully cultured cream cheese is a flavor powerhouse that elevates any dish. That’s right, cream cheese isn’t just for bagels anymore. With its clean, mild taste and smooth, medium-firm texture, it’s perfect for everything from cheesecakes, frostings, and savory spreads to innovative applications like sushi, tartines, and trendy cheese teas.","PASTEURIZED MILK AND CREAM, CHEESE CULTURE, SALT, GUAR GUM, XANTHAN GUM, CAROB BEAN GUM. CONTAINS: MILK",1/30#,Bulk,,Baking/Frosting; Frying; Spreading,CREAM CHEESE,,
american-heritage-yellow-pasteurized-process-cheese-product-singles-12-8oz-12-slices/,030900205076,AMERICAN HERITAGE YELLOW PASTEURIZED PROCESS CHEESE PRODUCT SINGLES – 12/8OZ 12 SLICES,"Want to take your menu to the next level? We’ve got just the thing. Designed for unbeatable convenience and consistency, American Heritage Yellow Pasteurized Process Cheese Product Singles are a game-changer for any kitchen. With a slightly salty, mild American cheese flavor profile, and a smooth and medium-firm texture, they’re the perfect addition to classics like burgers, grilled cheese sandwiches, and breakfast sandwiches. And that’s only the beginning.","MILK AND SKIM MILK, CREAM, MILK PROTEIN CONCENTRATE, WHEY, MODIFIED FOOD STARCH, SODIUM CITRATE, CALCIUM PHOSPHATE, SALT, WHEY PROTEIN CONCENTRATE, DAIRY PRODUCT SOLIDS, CHEESE CULTURE, SORBIC ACID (PRESERVATIVE), CITRIC ACID, LACTIC ACID, SODIUM PHOSPHATE, ENZYMES, COLOR ADDED, VITAMIN D3. CONTAINS: MILK",12/8OZ,Singles,,Hot Application - Topical Melt,PROCESSED CHEESE,3.5,3.5
schreiber-monterey-jack-loaf-2-5/,071505016476,SCHREIBER MONTEREY JACK LOAF – 2/5#,"With that clean, buttery Monterey Jack flavor and semi-hard, slightly curdy texture, each slice of this cheese is a masterpiece waiting to happen. Perfect for grilled sandwiches, creamy macaroni and cheese, or topping pizzas and pasta bakes, it can easily be shredded or sliced for any application.","PASTEURIZED MILK, CHEESE CULTURE, SALT, ENZYMES. CONTAINS: MILK",2/5#,Chunk,,Ready to Eat,NATURAL CHEESE,,
schreiber-provolone-4-inch-slices-12-1-16-slices/,071505015103,SCHREIBER PROVOLONE 4 INCH SLICES – 12/1# 16 SLICES,"Our Provolone cheese has a delicious blend of buttery and tangy flavors, accompanied by a smooth and firm texture. Each circular slice measures 4 inches in diameter, providing ample coverage, making it perfect for cold deli subs or hot philly cheesesteak sandwiches. Our premium, naturally sliced cheeses are designed to make your culinary creations even better with ease and efficiency, helping you reduce labor costs and eliminate product waste.","PASTEURIZED MILK, CHEESE CULTURE, SALT, ENZYMES. CONTAINS: MILK",12/1#,Slice,1oz.,HOT APPLICATION - INTERNAL MELT; COLD APPLICATION,NATURAL CHEESE,4,4
schreiber-monterey-jack-slices-12-1-20-slices/,071505014823,SCHREIBER MONTEREY JACK SLICES – 12/1# 20 SLICES,"With that clean, buttery Monterey Jack flavor and semi-hard, slightly curdy texture, each slice of this cheese is a masterpiece waiting to happen. Perfect for grilled cheese sandwiches and paninis, it also features interleaf paper between slices for effortless separation and two separate stacks to cut down on prep and cleaning time.","PASTEURIZED MILK, CHEESE CULTURE, SALT, ENZYMES. CONTAINS: MILK",12/1#,Slice,0.8oz.,Cold Application; Hot Application - Internal Melt,NATURAL CHEESE,3.5,3.66
friendship-lowfat-plain-yogurt-tub-4-5/,071505008242,FRIENDSHIP LOWFAT PLAIN YOGURT TUB – 4/5#,"Crafted to be the perfect canvas for your culinary masterpieces, our lowfat plain yogurt helps you entice patrons with anything from tender yogurt-marinated proteins to creamy dressings and dips. And, with its smooth and creamy texture and mild flavor profile, you can effortlessly replace sour cream or mayo in your most popular recipes, offering a healthier twist without sacrificing flavor. No matter what you create, you can be sure it’s going to be delicious. Plus, with its 5-pound size, it’s perfect for multiple occasions, ensuring you’ll always be ready for any culinary adventure.","CULTURED PASTEURIZED GRADE A LOW FAT MILK, NATAMYCIN (A NATURAL MOLD INHIBITOR). CONTAINS: MILK",4/5#,Large Cup,,Ready to Eat,YOGURT,,
schreiber-swiss-loaf-sandwich-cut-6-8-9-random-weight/,071505552974,SCHREIBER SWISS LOAF SANDWICH CUT – 6/8-9# RANDOM WEIGHT,"Crafted for those who appreciate quality and performance, this cheese has a mild, sweet, and nutty flavor profile that’s sure to delight your patrons. With a firm body and smooth texture, it’s perfect for slicing or shredding, whether you’re adding them to sandwiches, burgers, omelets, pasta, or soups. Plus, it melts beautifully when heated, ensuring a creamy and irresistible finish to your culinary creations.","PART-SKIM MILK, CHEESE CULTURE, SALT, ENZYMES. AGED OVER 60 DAYS.CONTAINS: MILK",6/8-9#R,Chunk,,Ready to Eat,NATURAL CHEESE,,
schreiber-muenster-slices-10-1-22-slices/,071505015356,SCHREIBER MUENSTER SLICES – 10/1# 22 SLICES,"Add that signature mild, slightly salty muenster flavor profile to your menu with a soft, smooth texture that’s perfect for melting. And, with two separate stacks, this will help you cut down on prep and cleaning time. So, whether you’re grilling up sandwiches, crafting the ultimate breakfast sandwich, or topping cheeseburgers, this cheese will elevate your dishes to gourmet status.","PASTEURIZED MILK, CHEESE CULTURE, SALT, ENZYMES, COLOR ADDED. CONTAINS: MILK",10/1#,Slice,0.75oz.,Cold Application; Hot Application - Internal Melt,NATURAL CHEESE,3.5,3.75
provolone-chunk-6-8-random-weight/,071505011303,PROVOLONE CHUNK – 6/8# RANDOM WEIGHT,"Take your sandwiches and cheesesteaks to the next level with this delectable cheese! With its buttery, mild, and tangy flavor profile, each bite is guaranteed to be unforgettable. Its circular slice cut makes it perfect for layering and creating visually appealing dishes across the board with instant cheese type recognition.","PASTEURIZED MILK, CHEESE CULTURE, SALT, ENZYMES. CONTAINS: MILK",6/8#R,Chunk,,Ready to Eat,NATURAL CHEESE,,
jalapeno-cream-cheese-spread-bulk-1-30/,071505020138,JALAPENO CREAM CHEESE SPREAD BULK – 1/30#,"Ready to spice up your dishes with some creamy goodness? This spread is the perfect blend of heat and creaminess featuring a kick of heat with its jalapeno flavor. Plus, with its efficient bulk size, you don’t need to worry about the hassle and waste of dealing with smaller packages. So, whether you’re spreading it on a bagel, adding it to a wrap or sandwich, or using it as a dip for an easy appetizer, this spread helps you elevate every bite.","PASTEURIZED MILK AND CREAM, WATER, JALAPENO PEPPERS, SALT, CHEESE CULTURE, SUGAR, ONION POWDER, GUAR GUM, YEAST EXTRACT, MINCED GARLIC, NATURAL FLAVOR, JALAPENO PEPPERS*, VINEGAR, XANTHAN GUM, CAROB BEAN GUM, GARLIC POWDER, GREEN BELL PEPPER POWDER, SPICE, TOMATO POWDER, CITRIC ACID, NATAMYCIN (A NATURAL MOLD INHIBITOR). *DRIED CONTAINS: MILK",1/30#,Bulk,,Spreading,CREAM CHEESE,,
schreiber-low-moisture-part-skim-mozzarella-feather-shreds-4-5/,071505014175,SCHREIBER LOW MOISTURE PART-SKIM MOZZARELLA FEATHER SHREDS – 4/5#,"Crafted with a classic feather shred for optimal coverage, this ready-to-use cheese saves you prep time and features a mild and slightly salty dairy profile, making it perfect for any dish. Whether you’re topping off a sizzling skillet, creating the perfect pizza or pasta dish, or adding a cheesy finish to your salads, it delivers a craveable melty texture and flavor that’ll keep your consumers coming back for more.","LOW-MOISTURE PART-SKIM MOZZARELLA CHEESE (PASTEURIZED PART-SKIM MILK, CHEESE CULTURE, SALT, ENZYMES), POTATO STARCH ADDED TO PREVENT CAKING, NATAMYCIN (A NATURAL MOLD INHIBITOR). CONTAINS: MILK",4/5#,Shredded,,Hot Application - Internal Melt; Hot Application - Topical Melt; Cold Application,NATURAL CHEESE,,
level-valley-creamery-cream-cheese-spread-tub-4-5/,029244005008,LEVEL VALLEY CREAMERY CREAM CHEESE SPREAD TUB – 4/5#,"Want to add a creamy touch to your offerings? These cream cheese tubs are the perfect solution. With their soft, spreadable texture and mild flavor profile, they’re versatile enough to enhance a variety of dishes. Whether you’re spreading them on a bagel or pastry, mixing them into a flavorful spread, or incorporating them into sandwiches and wraps, these cream cheese tubs will elevate your kitchen creations effortlessly. Plus, their convenient size makes them easy to store and use at any time.","PASTEURIZED MILK AND CREAM, CHEESE CULTURE, SALT, GUAR GUM, CITRIC ACID, CAROB BEAN GUM, XANTHAN GUM, NATAMYCIN (A NATURAL MOLD INHIBITOR). CONTAINS: MILK",4/5#,Tub,,SPREADING,CREAM CHEESE,,
american-heritage-cream-cheese-bar-8oz-bar-3-packs-of-12/,030900111308,AMERICAN HERITAGE CREAM CHEESE BAR – 8OZ BAR 3 PACKS OF 12,"Easy to handle and store, this fully cultured cream cheese is a flavor powerhouse that elevates any dish. That’s right, cream cheese isn’t just for bagels anymore. With its clean, mild taste and smooth, medium-firm texture, it’s perfect for everything from cheesecakes, frostings, and savory spreads to innovative applications like sushi, tartines, and trendy cheese teas.","PASTEURIZED MILK AND CREAM, CHEESE CULTURE, SALT, GUAR GUM, XANTHAN GUM, CAROB BEAN GUM. CONTAINS: MILK",3/12/8OZ,Bar,,Baking/Frosting; Frying; Spreading,CREAM CHEESE,,
pepper-jack-feather-shreds-4-5/,030900310756,PEPPER JACK FEATHER SHREDS – 4/5#,"Turn up the heat with this mouthwatering cheese! Crafted with a buttery flavor and a spicy kick from jalapeno peppers, this will help you add a zesty twist to any situation. Whether it’s sprinkled over salads and tacos or melted into quesadillas and pasta, you’ll get a burst of flavor consumers will love. And with its feather shred, you’ll enjoy excellent cheese coverage without the hassle saving you precious prep time and space in the kitchen.","MONTEREY JACK CHEESE WITH JALAPENO PEPPERS (PASTEURIZED MILK, JALAPENO PEPPERS, CHEESE CULTURE, SALT, ENZYMES), POTATO STARCH ADDED TO PREVENT CAKING, NATAMYCIN (A NATURAL MOLD INHIBITOR). CONTAINS: MILK",4/5#,Shredded,,Hot Application - Internal Melt; Hot Application - Topical Melt; Cold Application,NATURAL CHEESE,,
raskas-whipped-cream-cheese-spread-tub-4-3/,071505017497,RASKAS WHIPPED CREAM CHEESE SPREAD TUB – 4/3#,"This fully cultured cream cheese spread has a soft, creamy texture that makes it simple to schmear with a clean, mild flavor profile that allows you to use it in a variety of applications. Whether you’re adding it to bagels, pastries, sandwiches, burgers and wraps, or mixing it into your most popular recipes, Raskas Whipped Cream Cheese Spread helps you add a burst of flavor that’ll leave your consumers craving more. And with its convenient resealable container, it’s as easy to store as it is to use.","PASTEURIZED MILK AND CREAM, WHEY PROTEIN CONCENTRATE, MODIFIED FOOD STARCH, SALT, CHEESE CULTURE, GUAR GUM, LACTIC ACID, XANTHAN GUM, CAROB BEAN GUM, NATAMYCIN (A NATURAL MOLD INHIBITOR). CONTAINS: MILK",4/3#,Tub,,SPREADING,CREAM CHEESE,,
yellow-pasteurized-process-restricted-melt-sharp-american-slices-4-5-200-slices/,071505015974,YELLOW PASTEURIZED PROCESS RESTRICTED MELT SHARP AMERICAN SLICES – 4/5# 200 SLICES,"These slices are a must-have for taking burgers and breakfast to the next level. With a slightly salty, sharp American flavor profile and smooth, medium-firm texture, they’re the ultimate complement to any dish. Plus, with their restricted melt formulation, they’ll stand up to high-heat and freeze thaw applications like frozen breakfast sandwiches or burritos. They’re also pre-portioned with an EZ Pick staggered design to help you streamline kitchen preparation, reduce waste, and ensure easy separation for hassle-free cooking.","MILK, CREAM, WATER, SODIUM CITRATE, SALT, CONTAINS 2% OR LESS OF CHEESE CULTURE, CITRIC ACID, COLOR ADDED, ENZYMES, SORBIC ACID (PRESERVATIVE), SOY LECITHIN, TETRASODIUM PYROPHOSPHATE. CONTAINS: MILK, SOY",4/5#,Slice,0.4oz.,Hot Application - Restricted Melt,PROCESSED CHEESE,2.75,2.75
schreiber-low-moisture-whole-milk-mozzarella-feather-shreds-4-5/,071505014229,SCHREIBER LOW MOISTURE WHOLE MILK MOZZARELLA FEATHER SHREDS – 4/5#,"Crafted with a classic feather shred for optimal coverage, this ready-to-use cheese not only saves you prep time but is made with whole milk and has a mild and slightly salty dairy profile, making it perfect for any application. Whether you’re topping off a sizzling skillet, creating the perfect pizza, or adding a cheesy finish to your salads, you’ll get a craveable flavor and melty texture that’ll keep your consumers coming back for more.","LOW-MOISTURE MOZZARELLA CHEESE (PASTEURIZED MILK, CHEESE CULTURE, SALT, ENZYMES), POTATO STARCH ADDED TO PREVENT CAKING, NATAMYCIN (A NATURAL MOLD INHIBITOR). CONTAINS: MILK",4/5#,Shredded,,Hot Application - Internal Melt; Hot Application - Topical Melt; Cold Application,NATURAL CHEESE,,
havarti-slices-12-1-24-slices/,071505945035,HAVARTI SLICES – 12/1# 24 SLICES,"Our sliced Havarti cheese is crafted to have a delicate balance of flavors. It ages exceptionally well, developing delightful undertones of hazelnut over time, which helps enrich every dish with delicious complexity. And, with this mild, subtle taste and semi-hard, smooth texture, it’s a great versatile option for any menu. Whether it’s enhancing grilled cheese sandwiches or other paninis, it will give you and your consumers a luxurious experience every time.","PASTEURIZED MILK, CHEESE CULTURE, SALT, ENZYMES. CONTAINS: MILK",12/1#,Slice,0.67oz.,Cold Application; Hot Application - Internal Melt,NATURAL CHEESE,3.5,3.66
schreiber-mild-cheddar-fancy-shreds-4-5/,071505014212,SCHREIBER MILD CHEDDAR FANCY SHREDS – 4/5#,"Add just the right amount of everyone’s favorite mild Cheddar flavor to any culinary creation with this fancy shred. it’s easy to use but it’s even easier for consumers to love with its melty texture and a flavor that simply ignites the senses. Whether it’s sprinkled atop salads or tacos for a burst of freshness or melted over pasta, pizza, or a casserole for a creamy finish, it will help you elevate any dish.","CHEDDAR CHEESE (PASTEURIZED MILK, CHEESE CULTURE, SALT, ENZYMES, COLOR ADDED), POTATO STARCH ADDED TO PREVENT CAKING, NATAMYCIN (A NATURAL MOLD INHIBITOR). CONTAINS: MILK",4/5#,Shredded,,Hot Application - Internal Melt; Hot Application - Topical Melt; Cold Application,NATURAL CHEESE,,
schreiber-yellow-pasteurized-process-american-slices-6-3-72-slices/,071505013727,SCHREIBER YELLOW PASTEURIZED PROCESS AMERICAN SLICES – 6/3# 72 SLICES,"Whether you’re topping juicy burgers, making perfectly golden, grilled cheese sandwiches, or creating a crispy chicken sandwich, the smooth and melty texture of Schreiber Yellow Pasteurized Process American Slices is going to help you elevate every dish to gourmet status. And, with its horizontal stack and EZ Pick staggered slices, kitchen prep becomes effortless, ensuring easy separation, minimal waste, and unforgettable flavor in every bite.","MILK, CREAM, WATER, SODIUM CITRATE, SALT, CHEESE CULTURE, SORBIC ACID (PRESERVATIVE), CITRIC ACID, ENZYMES, SOY LECITHIN, COLOR ADDED. CONTAINS: MILK, SOY",6/3#,Slice,0.67oz.,Hot Application - Internal Melt,PROCESSED CHEESE,3.375,3.375
schreiber-yellow-pasteurized-process-restricted-melt-american-slices-4-5-160-slices/,071505013802,SCHREIBER YELLOW PASTEURIZED PROCESS RESTRICTED MELT AMERICAN SLICES – 4/5# 160 SLICES,"Bring some sizzle to your grilling game using a creamy, delicious process cheese that’s crafted to withstand high heat. With an innovative horizontal stack and EZ Pick slices, separating and adding a decadent layer of flavor has never been easier. Simply put, it’s the best cheese for freeze and reheat applications like breakfast sandwiches and burritos or high heat applications like stuffed burgers. We’d say get ready for pure cheesy perfection, but there’s no prep needed. So, it looks like you and your consumers can just relax and enjoy.","MILK, WATER, CREAM, SODIUM CITRATE, SALT, CHEESE CULTURE, TETRASODIUM PYROPHOSPHATE, SORBIC ACID (PRESERVATIVE), ENZYMES, SOY LECITHIN, CITRIC ACID, COLOR ADDED. CONTAINS: MILK, SOY",4/5#,Slice,0.5oz.,Hot Application - Restricted Melt,PROCESSED CHEESE,3,3
schreiber-pasteurized-process-pepper-jack-slices-12-1-24-slices/,071505015561,SCHREIBER PASTEURIZED PROCESS PEPPER JACK SLICES – 12/1# 24 SLICES,"Schreiber Pasteurized Process Pepper Jack Slices are your go-to for convenience, flavor, and all-around melty goodness! With their slightly salty Monterey Jack flavor profile and a hint of mild heat from peppers, they’re perfect for giving your menu items an extra kick of deliciousness. Ready-to-eat and hassle-free, they require no prep, so they’re perfect for any meal occasion from breakfast sandwiches to juicy burgers to adding a spicy twist to your consumers’ favorite grilled cheese sandwich.","MILK, CREAM, WATER, SODIUM CITRATE, SALT, CHEESE CULTURE, JALAPENO PEPPERS, JALAPENO PEPPER PUREE, SORBIC ACID (PRESERVATIVE), JALAPENO PEPPERS*, ENZYMES, RED BELL PEPPERS*, CITRIC ACID, SOY LECITHIN, VINEGAR, NATURAL FLAVOR. *DRIED CONTAINS: MILK, SOY",12/1#,Slice,0.67oz.,Hot Application - Internal Melt,PROCESSED CHEESE,3.375,3.375
schreiber-pasteurized-process-hot-pepper-jack-cubes-4-5/,071505015554,SCHREIBER PASTEURIZED PROCESS HOT PEPPER JACK CUBES – 4/5#,"Our irresistible process hot Pepper Jack cheese, conveniently pre-cubed for fast and easy use. This ready-to-serve format offers consistent cut and quality, reducing labor costs and eliminating waste. And with a smooth, medium-firm texture, each bite promises a delightful blend of flavor and just a bit of heat from the peppers. They’re a versatile addition to any menu and perfect for snacking occasions like cheese trays or paired with fruit and nuts for a harmonious blend of flavors and textures that everyone you serve will love.","MILK, CREAM, WATER, JALAPENO PEPPERS, SALT, SODIUM PHOSPHATE, CONTAINS 2% OR LESS OF CHEESE CULTURE, COLOR ADDED, ENZYMES, RED BELL PEPPERS*, SORBIC ACID (PRESERVATIVE), VINEGAR. *DRIED CONTAINS: MILK",4/5#,Snack,,Ready to Eat,PROCESSED CHEESE,,
pauly-cream-cheese-loaf-10-3/,030900007014,PAULY CREAM CHEESE LOAF – 10/3#,"This fully cultured cream cheese loaf is a flavor powerhouse that elevates any dish. That’s right, cream cheese isn’t just for bagels anymore. With its clean, mild taste and smooth, medium-firm texture, it’s perfect for everything from cheesecakes, frostings, and savory spreads to innovative applications like sushi, pastas, and trendy cheese teas.","PASTEURIZED MILK AND CREAM, CHEESE CULTURE, SALT, GUAR GUM, XANTHAN GUM, CAROB BEAN GUM. CONTAINS: MILK",10/3#,Loaf,,Baking/Frosting; Frying; Spreading,CREAM CHEESE,,
american-heritage-string-cheese-retail-package-12-1/,030900111650,AMERICAN HERITAGE STRING CHEESE RETAIL PACKAGE – 12/1#,"With its mild and slightly salty dairy profile, this string cheese is the perfect choice for any on-the-go eating occasion. Delightfully convenient and individually wrapped, each serving guarantees freshness and quality in every bite. String cheese is a great snack on its own, but also pairs nicely with fresh fruit, sliced vegetables and crackers.","PASTEURIZED PART-SKIM MILK, CHEESE CULTURE, SALT, ENZYMES. CONTAINS: MILK",12/1#,String,,Ready to Eat,NATURAL CHEESE,,
american-heritage-mild-cheddar-chunk-12-8oz/,030900911618,AMERICAN HERITAGE MILD CHEDDAR CHUNK – 12/8OZ,"American Heritage Mild Cheddar promises unbeatable quality and performance for those who prefer to shred or slice straight from the block. It has a clean, full-flavor profile with a hint of sweetness and a firm body making it ideal for shredding, slicing, or cubing. it’s never been easier to add a deliciously creamy touch to sandwiches, burgers, omelets, pasta, soups, and charcuterie boards.","PASTEURIZED MILK, CHEESE CULTURE, SALT, ENZYMES, COLOR ADDED. CONTAINS: MILK",12/8OZ,Chunk,,Ready to Eat,NATURAL CHEESE,,
medium-cheddar-slices-6-1-5-32-slices/,071505944021,MEDIUM CHEDDAR SLICES – 6/1.5# 32 SLICES,"Our medium cheddar delivers a clean and robust flavor that balances moderate sharpness with a sweet finish. When heated, our Medium Cheddar Slices melt seamlessly, making them the perfect addition to both hot and cold sandwiches, as well as mouthwatering burgers. Each slice is separated by interleaf paper and arranged in two separate stacks for effortless separation and easy handling. Enjoy the highest quality medium cheddar while minimizing labor costs and waste.","PASTEURIZED MILK, CHEESE CULTURE, SALT, ENZYMES, COLOR ADDED. CONTAINS: MILK",6/1.5#,Slice,0.75oz.,Cold Application; Hot Application - Internal Melt,NATURAL CHEESE,3.5,3.66
land-o-lakes-lowfat-plain-yogurt-tub-4-5/,034500633383,LAND O LAKES LOWFAT PLAIN YOGURT TUB – 4/5#,"Crafted to be the perfect canvas for your culinary masterpieces, our lowfat plain yogurt helps you entice patrons with anything from tender yogurt-marinated proteins to creamy dressings and dips. And, with its smooth and creamy texture and mild flavor profile, you can effortlessly replace sour cream or mayo in your most popular recipes, offering a healthier twist without sacrificing flavor. No matter what you create, you can be sure it’s going to be delicious. Plus, with its 5-pound size, it’s perfect for multiple occasions, ensuring you’ll always be ready for any culinary adventure.","CULTURED PASTEURIZED GRADE A LOW FAT MILK, SUGAR, MODIFIED FOOD STARCH, CARRAGEENAN, PECTIN, NATURAL FLAVOR, VITAMIN A PALMITATE, VITAMIN D3. CONTAINS: MILK",4/5#,Large Cup,,READY TO EAT,YOGURT,,
schreiber-mild-cheddar-feather-shreds-4-5/,071505014687,SCHREIBER MILD CHEDDAR FEATHER SHREDS – 4/5#,"Add just the right amount of everyone’s favorite mild Cheddar flavor to any culinary creation with this feather shred. it’s easy to use but it’s even easier for consumers to love with its melty texture and a flavor that simply ignites the senses. Whether it’s sprinkled atop salads or tacos for a boost of appeal or melted over pasta, pizza, or a casserole for a creamy finish, it will help you elevate any dish.","CHEDDAR CHEESE (PASTEURIZED MILK, CHEESE CULTURE, SALT, ENZYMES, COLOR ADDED), POTATO STARCH ADDED TO PREVENT CAKING, NATAMYCIN (A NATURAL MOLD INHIBITOR). CONTAINS: MILK",4/5#,Shredded,,Hot Application - Internal Melt; Hot Application - Topical Melt; Cold Application,NATURAL CHEESE,,
